[
  {
    "age_condition_text": "19세 ~ 34세",
    "age_max": 34,
    "age_min": 19,
    "application_end": "2026-06-30",
    "application_method": "온라인 신청",
    "application_period_text": "2026. 1. 1. ~ 2026. 6. 30.",
    "application_schedule": "fixed_period",
    "application_start": "2026-01-01",
    "application_status": "closed",
    "categories": [
      "housing"
    ],
    "category_text": "주거",
    "collected_at": "2026-07-26T06:00:00+00:00",
    "coverage_scope": "unknown",
    "data_quality_status": "valid",
    "education_statuses": [],
    "eligibility_summary": {
      "coverage": "partial",
      "documents": [],
      "exclusions": [],
      "institutional_contacts": [],
      "preferences": [],
      "requirements": [
        {
          "category": "age",
          "evidence": [
            {
              "collected_at": "2026-07-26T06:00:00+00:00",
              "locator": "sprtTrgtAgeLmtYn",
              "locator_type": "source_field",
              "source_id": "youthcenter-api",
              "source_url": "https://fixture.invalid/youth/001"
            },
            {
              "collected_at": "2026-07-26T06:00:00+00:00",
              "locator": "sprtTrgtMinAge",
              "locator_type": "source_field",
              "source_id": "youthcenter-api",
              "source_url": "https://fixture.invalid/youth/001"
            },
            {
              "collected_at": "2026-07-26T06:00:00+00:00",
              "locator": "sprtTrgtMaxAge",
              "locator_type": "source_field",
              "source_id": "youthcenter-api",
              "source_url": "https://fixture.invalid/youth/001"
            }
          ],
          "text": "19세 ~ 34세"
        }
      ],
      "unknowns": [
        {
          "category": "other",
          "evidence": [
            {
              "collected_at": "2026-07-26T06:00:00+00:00",
              "locator": "ptcpPrpTrgtCn",
              "locator_type": "source_field",
              "source_id": "youthcenter-api",
              "source_url": "https://fixture.invalid/youth/001"
            }
          ],
          "text": "합성 청년 대상"
        }
      ]
    },
    "eligibility_text": "합성 청년 대상",
    "employment_statuses": [],
    "excluded_conditions": [],
    "external_id": "SYN-YOUTH-001",
    "keywords": [
      "주거비 지원",
      "월세",
      "보조금"
    ],
    "life_stages": [],
    "organization": "합성 주거기관",
    "preferred_conditions": [],
    "provenance": [
      {
        "collected_at": "2026-07-26T06:00:00+00:00",
        "content_hash": "sha256:2b3fe0c43ce44aeaeec80dc712e4c8efe9c30b2289b091ac5de2dc54feefe403",
        "document_role": "list_response",
        "raw_document_id": "10000000000000000000000000000000",
        "source_url": "https://fixture.invalid/youthcenter/getPlcy"
      },
      {
        "collected_at": "2026-07-26T06:00:00+00:00",
        "content_hash": "sha256:d2d2de4c10a3eb1b62f3390418c75c3439a71e0f142b5854e0c7c2408e7b8a03",
        "document_role": "list_item",
        "raw_document_id": "11000000000000000000000000000001",
        "source_url": "https://fixture.invalid/youthcenter/getPlcy"
      }
    ],
    "region_rules": [],
    "region_text": "서울시",
    "regions": [
      "서울특별시"
    ],
    "required_conditions": [],
    "schema_version": "1.2.0",
    "source_id": "youthcenter-api",
    "source_name": "온통청년 청년정책 API",
    "source_url": "https://fixture.invalid/youth/001",
    "summary": "합성 청년 주거 정책 요약",
    "support_content": "합성 월 지원",
    "target_groups": [],
    "title": "합성 청년 주거 지원"
  },
  {
    "age_condition_text": "연령 제한 없음",
    "age_max": null,
    "age_min": null,
    "application_end": null,
    "application_method": null,
    "application_period_text": "상시",
    "application_schedule": "always",
    "application_start": null,
    "application_status": "open",
    "categories": [
      "finance",
      "welfare"
    ],
    "category_text": "금융･복지･문화",
    "collected_at": "2026-07-26T06:00:00+00:00",
    "coverage_scope": "nationwide",
    "data_quality_status": "valid",
    "education_statuses": [],
    "eligibility_summary": {
      "coverage": "partial",
      "documents": [],
      "exclusions": [],
      "institutional_contacts": [],
      "preferences": [],
      "requirements": [
        {
          "category": "age",
          "evidence": [
            {
              "collected_at": "2026-07-26T06:00:00+00:00",
              "locator": "sprtTrgtAgeLmtYn",
              "locator_type": "source_field",
              "source_id": "youthcenter-api",
              "source_url": "https://fixture.invalid/youth/002"
            }
          ],
          "text": "연령 제한 없음"
        }
      ],
      "unknowns": []
    },
    "eligibility_text": null,
    "employment_statuses": [],
    "excluded_conditions": [],
    "external_id": "SYN-YOUTH-002",
    "keywords": [
      "생활지원",
      "생활비"
    ],
    "life_stages": [],
    "organization": "합성 등록기관",
    "preferred_conditions": [],
    "provenance": [
      {
        "collected_at": "2026-07-26T06:00:00+00:00",
        "content_hash": "sha256:2b3fe0c43ce44aeaeec80dc712e4c8efe9c30b2289b091ac5de2dc54feefe403",
        "document_role": "list_response",
        "raw_document_id": "10000000000000000000000000000000",
        "source_url": "https://fixture.invalid/youthcenter/getPlcy"
      },
      {
        "collected_at": "2026-07-26T06:00:00+00:00",
        "content_hash": "sha256:5cbe2b93336f6435bb0d3dc5e300c11f0c22fe0eab3be73fe18b44c9fa7f1af2",
        "document_role": "list_item",
        "raw_document_id": "11000000000000000000000000000002",
        "source_url": "https://fixture.invalid/youthcenter/getPlcy"
      }
    ],
    "region_rules": [],
    "region_text": "전국",
    "regions": [
      "전국"
    ],
    "required_conditions": [],
    "schema_version": "1.2.0",
    "source_id": "youthcenter-api",
    "source_name": "온통청년 청년정책 API",
    "source_url": "https://fixture.invalid/youth/002",
    "summary": "합성 상시 생활 정책 요약",
    "support_content": "합성 생활 지원",
    "target_groups": [],
    "title": "합성 상시 생활 지원"
  },
  {
    "age_condition_text": null,
    "age_max": null,
    "age_min": null,
    "application_end": null,
    "application_method": null,
    "application_period_text": null,
    "application_schedule": null,
    "application_start": null,
    "application_status": null,
    "categories": [
      "housing",
      "finance"
    ],
    "category_text": "주거,서민금융",
    "collected_at": "2026-07-26T06:01:00+00:00",
    "coverage_scope": "unknown",
    "data_quality_status": "partial",
    "education_statuses": [],
    "eligibility_summary": {
      "coverage": "partial",
      "documents": [],
      "exclusions": [],
      "institutional_contacts": [],
      "preferences": [],
      "requirements": [
        {
          "category": "other",
          "evidence": [
            {
              "collected_at": "2026-07-26T06:01:00+00:00",
              "locator": "tgtrDtlCn",
              "locator_type": "source_field",
              "source_id": "bokjiro-central-welfare-api",
              "source_url": "https://fixture.invalid/bokjiro/001"
            }
          ],
          "text": "합성 지원 대상"
        }
      ],
      "unknowns": [
        {
          "category": "other",
          "evidence": [
            {
              "collected_at": "2026-07-26T06:01:00+00:00",
              "locator": "slctCritCn",
              "locator_type": "source_field",
              "source_id": "bokjiro-central-welfare-api",
              "source_url": "https://fixture.invalid/bokjiro/001"
            }
          ],
          "text": "합성 선정 기준"
        }
      ]
    },
    "eligibility_text": "합성 지원 대상 합성 선정 기준",
    "employment_statuses": [],
    "excluded_conditions": [],
    "external_id": "SYN-BOK-001",
    "keywords": [
      "주거",
      "서민금융"
    ],
    "life_stages": [
      "청년"
    ],
    "organization": "합성 복지부처",
    "preferred_conditions": [],
    "provenance": [
      {
        "collected_at": "2026-07-26T06:00:00+00:00",
        "content_hash": "sha256:06b41052833f1e2a755fc52bb8a1b51420bf9ec451f636e55368a296d8b5869e",
        "document_role": "list_response",
        "raw_document_id": "20000000000000000000000000000000",
        "source_url": "https://fixture.invalid/bokjiro/list"
      },
      {
        "collected_at": "2026-07-26T06:00:00+00:00",
        "content_hash": "sha256:58d9cc0b7ba2a16f73bea234d9e1a1c927fd984132f5f35848a738c2eec28a26",
        "document_role": "list_item",
        "raw_document_id": "21000000000000000000000000000001",
        "source_url": "https://fixture.invalid/bokjiro/list"
      },
      {
        "collected_at": "2026-07-26T06:01:00+00:00",
        "content_hash": "sha256:fcb900c875f107ca0493e1a677356bdbcb6696f9de6c09ae73bb5259412933e4",
        "document_role": "detail_response",
        "raw_document_id": "22000000000000000000000000000001",
        "source_url": "https://fixture.invalid/bokjiro/detail"
      }
    ],
    "region_rules": [],
    "region_text": null,
    "regions": [],
    "required_conditions": [],
    "schema_version": "1.2.0",
    "source_id": "bokjiro-central-welfare-api",
    "source_name": "복지로 중앙부처 복지서비스 API",
    "source_url": "https://fixture.invalid/bokjiro/001",
    "summary": "합성 상세 정책 개요",
    "support_content": "합성 상세 지원 내용",
    "target_groups": [
      "저소득 청년"
    ],
    "title": "합성 청년 자산 지원 상세"
  },
  {
    "age_condition_text": null,
    "age_max": null,
    "age_min": null,
    "application_end": null,
    "application_method": null,
    "application_period_text": null,
    "application_schedule": null,
    "application_start": null,
    "application_status": null,
    "categories": [],
    "category_text": null,
    "collected_at": "2026-07-26T06:00:00+00:00",
    "coverage_scope": "unknown",
    "data_quality_status": "partial",
    "education_statuses": [],
    "eligibility_summary": {
      "coverage": "unknown",
      "documents": [],
      "exclusions": [],